{
  "description": "Gajendra Deshpande\n\n\nKLS Gogte Institute of Technology\n\n\nSocial Networks:\n\nFacebook: https://www.facebook.com/gcdeshpande\nTwitter: https://twitter.com/gcdeshpande\nGithub: https://github.com/gcdeshpande\nLinkedIn: https://www.linkedin.com/in/gajendradeshpande\n\n\n\n\nMultilingual Natural Language Processing using Python\n\nNatural Language Processing(NLP) is an interesting and challenging field. It becomes even more interesting and challenging when we take into consideration more than one human language. when we perform an NLP on a single language there is a possibility that the interesting insights from another human language might be missed out. The interesting and valuable information may be available in other human languages such as Spanish, Chinese, French, Hindi, and other major languages of the world. Also, the information may be available in various formats such as text, images, audio, and video.\n\nFollow us\n\nFacebook: https://www.facebook.com/pyconcolombia\nTwitter: https://twitter.com/pyconcolombia\nInstagram:  https://www.instagram.com/pyconcolombia/\nTelegram: https://t.me/pyconcolombia\nLinkedIn: https://www.linkedin.com/company/pycon-colombia/\nFlickr: https://www.flickr.com/photos/pyconcolombia/\n\nMore About PyCon Colombia at http://www.pycon.co",
  "duration": 1878,
  "language": "eng",
  "recorded": "2021-06-19",
  "related_urls": [
    {
      "label": "Conference Website",
      "url": "https://2021.pycon.co/"
    },
    {
      "label": "https://twitter.com/gcdeshpande",
      "url": "https://twitter.com/gcdeshpande"
    },
    {
      "label": "https://www.linkedin.com/company/pycon-colombia/",
      "url": "https://www.linkedin.com/company/pycon-colombia/"
    },
    {
      "label": "https://www.facebook.com/pyconcolombia",
      "url": "https://www.facebook.com/pyconcolombia"
    },
    {
      "label": "https://t.me/pyconcolombia",
      "url": "https://t.me/pyconcolombia"
    },
    {
      "label": "http://www.pycon.co",
      "url": "http://www.pycon.co"
    },
    {
      "label": "https://www.facebook.com/gcdeshpande",
      "url": "https://www.facebook.com/gcdeshpande"
    },
    {
      "label": "https://twitter.com/pyconcolombia",
      "url": "https://twitter.com/pyconcolombia"
    },
    {
      "label": "https://www.flickr.com/photos/pyconcolombia/",
      "url": "https://www.flickr.com/photos/pyconcolombia/"
    },
    {
      "label": "https://www.linkedin.com/in/gajendradeshpande",
      "url": "https://www.linkedin.com/in/gajendradeshpande"
    },
    {
      "label": "https://github.com/gcdeshpande",
      "url": "https://github.com/gcdeshpande"
    },
    {
      "label": "https://www.instagram.com/pyconcolombia/",
      "url": "https://www.instagram.com/pyconcolombia/"
    }
  ],
  "speakers": [
    "Gajendra Deshpande"
  ],
  "tags": [],
  "thumbnail_url": "https://i.ytimg.com/vi_webp/ORRMYyPzgLU/maxresdefault.webp",
  "title": "Multilingual Natural Language Processing using Python",
  "videos": [
    {
      "type": "youtube",
      "url": "https://www.youtube.com/watch?v=ORRMYyPzgLU"
    }
  ]
}
