{
  "description": "Lightning Talks Day 1\nSpeakers: Logan Kilpatrick, Braden Riggs, Jacob Zelko, John Cox, Miki Tebeka, Neel Surya, Nik Agarwal, Raghuram Thiagarajan, Rongpeng Li (Ron), Timo Metzger, Timothy Odom, Xu Chen\n\nSummary\nLightning Talks are short 5-10 minute sessions presented by community members on a variety of interesting topics.\n\nDescription\nOrder of Presentations\n\n1. Raghuram Thiagarajan, Neel Surya, Timothy Odom, Xu Chen - An online pedagogical tool for data science using Bokeh\n2. Logan Kilpatrick - The importance of non-code open source contributions\n3. Nik Agarwal - Best of Both Worlds: R & Python\n4. Rongpeng Li (Ron) - Can the \u201cBest\u201d Language Model Detect Logical Fallacies?\n5. Braden Riggs - Unlocking Insight from Your Media Collection By Analyzing Audio\n6. Jacob Zelko - A Visual Odyssey: Animations and Visualizations Made with Julia\n7. John Cox - How Generative Adverserial Networks (GANs) Can Predict the Rank of Elliptic Curves\n8. Timo Metzger - What's new in Bokeh 2.4\n9. Miki Tebeka - Using IPython as Presentation Tool\n\nPyData Global 2021\nWebsite: https://pydata.org/global2021/\nLinkedIn: https://www.linkedin.com/company/pydata-global\nTwitter: https://twitter.com/PyData\n\nwww.pydata.org\n\nPyData is an educational program of NumFOCUS, a 501(c)3 non-profit organization in the United States. PyData provides a forum for the international community of users and developers of data analysis tools to share ideas and learn from each other. The global PyData network promotes discussion of best practices, new approaches, and emerging technologies for data management, processing, analytics, and visualization. PyData communities approach data science using many languages, including (but not limited to) Python, Julia, and R. \n\nPyData conferences aim to be accessible and community-driven, with novice to advanced level presentations. PyData tutorials and talks bring attendees the latest project features along with cutting-edge use cases.\n\n00:00 Welcome!\n00:10 Help us add time stamps or captions to this video! See the description for details.\n\nWant to help add timestamps to our YouTube videos to help with discoverability? Find out more here: https://github.com/numfocus/YouTubeVideoTimestamps",
  "duration": 4714,
  "language": "eng",
  "recorded": "2021-10-28",
  "related_urls": [
    {
      "label": "Conference Website",
      "url": "https://pydata.org/global2021/"
    },
    {
      "label": "https://www.linkedin.com/company/pydata-global",
      "url": "https://www.linkedin.com/company/pydata-global"
    },
    {
      "label": "https://github.com/numfocus/YouTubeVideoTimestamps",
      "url": "https://github.com/numfocus/YouTubeVideoTimestamps"
    },
    {
      "label": "https://pydata.org/global2021/",
      "url": "https://pydata.org/global2021/"
    },
    {
      "label": "https://twitter.com/PyData",
      "url": "https://twitter.com/PyData"
    }
  ],
  "speakers": [
    "Logan Kilpatrick",
    "Braden Riggs",
    "Jacob Zelko",
    "John Cox",
    "Miki Tebeka",
    "Neel Surya",
    "Nik Agarwal",
    "Raghuram Thiagarajan",
    "Rongpeng Li (Ron)",
    "Timo Metzger",
    "Timothy Odom",
    "Xu Chen"
  ],
  "tags": [],
  "thumbnail_url": "https://i.ytimg.com/vi/QXf9HzB0GR8/maxresdefault.jpg",
  "title": "Lightning Talks Day 1",
  "videos": [
    {
      "type": "youtube",
      "url": "https://www.youtube.com/watch?v=QXf9HzB0GR8"
    }
  ]
}
