{
  "description": "Packaging PyData for Enterprise Software Supply Chain (pre-recording)\nSpeakers: Zayd Ma, Hussain Sultan\n\nSummary\nThe U.S. Air Force and MetroStar introduced a newly created open-source tool called conda-vendor. The tool, designed by data scientists, allows users to use .yaml files in air-gapped, offline, and secured climates. This talk will cover the reasoning behind the new tool, its abilities, features, and we'll demonstrate how to use it.\n\nDescription\nThe U.S. Air Force and MetroStar introduced a newly created open-source tool called conda-vendor. The tool, designed by data scientists, allows users to use .yaml files in air-gapped, offline, and secured climates. This talk will cover the reasoning behind the new tool, its abilities, features, and we'll demonstrate how to use it.\n\nZayd Ma's Bio\nZayd Ma, PhD, Physics: Working at 309th Software Engineering group on data infrastructure, data engineering, and data science projects directly related to the Air Force Sustainment Center operations and mission needs.\nLinkedIn: https://www.linkedin.com/in/zayd-m-11b9385/\n\nHussain Sultan's Bio\nHussain Sultan is the Director of Artificial Intelligence (AI) at MetroStar. Hussain is introducing and defining what Actionable AI/ML is for MetroStar and their customers. He brings commercial skills to the government contracting space from his decades of experience. His current work will enable customer-backed AI/ML solutions while considering the security, privacy, and explainability needs of the client.\nLinkedIn: https://www.linkedin.com/in/hussainsultan/\n\nPyData Global 2021\nWebsite: https://pydata.org/global2021/\nLinkedIn: https://www.linkedin.com/company/pydata-global\nTwitter: https://twitter.com/PyData\n\nwww.pydata.org\n\nPyData is an educational program of NumFOCUS, a 501(c)3 non-profit organization in the United States. PyData provides a forum for the international community of users and developers of data analysis tools to share ideas and learn from each other. The global PyData network promotes discussion of best practices, new approaches, and emerging technologies for data management, processing, analytics, and visualization. PyData communities approach data science using many languages, including (but not limited to) Python, Julia, and R. \n\nPyData conferences aim to be accessible and community-driven, with novice to advanced level presentations. PyData tutorials and talks bring attendees the latest project features along with cutting-edge use cases.\n\n00:00 Welcome!\n00:10 Help us add time stamps or captions to this video! See the description for details.\n\nWant to help add timestamps to our YouTube videos to help with discoverability? Find out more here: https://github.com/numfocus/YouTubeVideoTimestamps",
  "duration": 962,
  "language": "eng",
  "recorded": "2021-10-28",
  "related_urls": [
    {
      "label": "Conference Website",
      "url": "https://pydata.org/global2021/"
    },
    {
      "label": "https://www.linkedin.com/company/pydata-global",
      "url": "https://www.linkedin.com/company/pydata-global"
    },
    {
      "label": "https://github.com/numfocus/YouTubeVideoTimestamps",
      "url": "https://github.com/numfocus/YouTubeVideoTimestamps"
    },
    {
      "label": "https://www.linkedin.com/in/hussainsultan/",
      "url": "https://www.linkedin.com/in/hussainsultan/"
    },
    {
      "label": "https://www.linkedin.com/in/zayd-m-11b9385/",
      "url": "https://www.linkedin.com/in/zayd-m-11b9385/"
    },
    {
      "label": "https://twitter.com/PyData",
      "url": "https://twitter.com/PyData"
    },
    {
      "label": "https://pydata.org/global2021/",
      "url": "https://pydata.org/global2021/"
    }
  ],
  "speakers": [
    "Zayd Ma",
    "Hussain Sultan"
  ],
  "tags": [],
  "thumbnail_url": "https://i.ytimg.com/vi/ltRI13eM6nw/maxresdefault.jpg",
  "title": "Packaging PyData for Enterprise Software Supply Chain",
  "videos": [
    {
      "type": "youtube",
      "url": "https://www.youtube.com/watch?v=ltRI13eM6nw"
    }
  ]
}
