{
  "description": "Tech for Posterity. Challenges for the Future of AI Ethics and DEI\nSpeakers: Oyidiya Oji\n\nSummary\nFor the first time, PyData Global is organizing \"Tech for Posterity. Challenges for the Future of AI Ethics and DEI\" and it will take place on 30th October. This workshop is for everyone who is interested in these amazing topics. We encourage everyone to join and learn a diverse number of top-notch experts on both fields.\n\nDescription\nThe workshop structure will be as follows:\n\n16:00 - 16:10 Welcome (Oyidiya Oji)\n16:10 - 16:30 AI Ethics and DEI Are a Leadership Responsibility (Tebogo R. Mazibuko)\n16:30 - 16:50 Safe Spaces: Where Everyone Is Safe To Be Themselves (Marie Roker-Jone)\n16:50 - 17:10 Q&A - How to Be an Ally?\n17:10 - 17:30 How to build an AI Ethics Committee (Ana Chubinidze)\n17:30 - 18:00 Panel: How to overcome Impostor Syndrome?\n18:00 - 18:10 Break\n18:10 - 18:30 DEI Hiring and AI Ethics (Hnin EiEi Tun)\n18:30 - 18:50 The Importance of Safe Spaces in the Workplace (Kave Bulambo)\n18:50 - 19:30 Panel: The Future of Work\n19:30 - 19:35 Closing\n19:35 - 20:00 Networking at gather.town with all participants9 different talks about AI Ethics and DEI.\n\nOyidiya Oji's Bio\nOyidiya is a former international athlete and a data scientist from Barcelona. She is passionate about data and her curiosity made her discover that tech products are not yet made for everyone. She loves giving awareness about this and other issues as well as empowering tech leaders and users to fight for change in the tech industry.\nGitHub: https://github.com/oyidiyaoji/\nTwitter: https://twitter.com/oyidiyaoji/\nLinkedIn: https://twitter.com/oyidiyaoji/\n\nPyData Global 2021\nWebsite: https://pydata.org/global2021/\nLinkedIn: https://www.linkedin.com/company/pydata-global\nTwitter: https://twitter.com/PyData\n\nwww.pydata.org\n\nPyData is an educational program of NumFOCUS, a 501(c)3 non-profit organization in the United States. PyData provides a forum for the international community of users and developers of data analysis tools to share ideas and learn from each other. The global PyData network promotes discussion of best practices, new approaches, and emerging technologies for data management, processing, analytics, and visualization. PyData communities approach data science using many languages, including (but not limited to) Python, Julia, and R. \n\nPyData conferences aim to be accessible and community-driven, with novice to advanced level presentations. PyData tutorials and talks bring attendees the latest project features along with cutting-edge use cases.\n\n00:00 Welcome!\n00:10 Help us add time stamps or captions to this video! See the description for details.\n\nWant to help add timestamps to our YouTube videos to help with discoverability? Find out more here: https://github.com/numfocus/YouTubeVideoTimestamps",
  "duration": 11974,
  "language": "eng",
  "recorded": "2021-10-28",
  "related_urls": [
    {
      "label": "Conference Website",
      "url": "https://pydata.org/global2021/"
    },
    {
      "label": "https://www.linkedin.com/company/pydata-global",
      "url": "https://www.linkedin.com/company/pydata-global"
    },
    {
      "label": "https://github.com/numfocus/YouTubeVideoTimestamps",
      "url": "https://github.com/numfocus/YouTubeVideoTimestamps"
    },
    {
      "label": "https://github.com/oyidiyaoji/",
      "url": "https://github.com/oyidiyaoji/"
    },
    {
      "label": "https://twitter.com/oyidiyaoji/",
      "url": "https://twitter.com/oyidiyaoji/"
    },
    {
      "label": "https://twitter.com/PyData",
      "url": "https://twitter.com/PyData"
    },
    {
      "label": "https://pydata.org/global2021/",
      "url": "https://pydata.org/global2021/"
    }
  ],
  "speakers": [
    "Oyidiya Oji"
  ],
  "tags": [],
  "thumbnail_url": "https://i.ytimg.com/vi/kMJR4vSzC9I/maxresdefault.jpg",
  "title": "Tech for Posterity. Challenges for the Future of AI Ethics and DEI",
  "videos": [
    {
      "type": "youtube",
      "url": "https://www.youtube.com/watch?v=kMJR4vSzC9I"
    }
  ]
}
