{
  "description": "Poster Spotlights 2 (session chair: Taposh Banerjee)\n\n651   |   Adaptivity Complexity for Causal Graph Discovery   \nDavin Choo, Kirankumar Shiragur,\nhttps://proceedings.mlr.press/v216/choo23a.html\n\n707   |   Phase-shifted Adversarial Training   \nYeachan Kim, Seongyeon Kim, Ihyeok Seo, Bonggun Shin,\nhttps://proceedings.mlr.press/v216/kim23b.html\n\n804   |   Fast Proximal Gradient Descent for Support Regularized Sparse Graph   \nDongfang Sun, Yingzhen Yang,\nhttps://proceedings.mlr.press/v216/sun23c.html\n\n56   |   Stochastic Generative Flow Networks   \nLing Pan, Dinghuai Zhang, Moksh Jain, Longbo Huang, Yoshua Bengio,\nhttps://proceedings.mlr.press/v216/pan23a.html\n\n654   |   Dirichlet Proportions Model for Hierarchically Coherent Probabilistic Forecasting   \nAbhimanyu Das, Weihao Kong, Biswajit Paria, Rajat Sen,\nhttps://proceedings.mlr.press/v216/das23b.html\n\n186   |   Inference for Mark-Censored Temporal Point Processes   \nAlex James Boyd, Yuxin Chang, Stephan Mandt, Padhraic Smyth,\nhttps://proceedings.mlr.press/v216/boyd23a.html\n\n643   |   Testing Conventional Wisdom (of the Crowd)   \nNoah Burrell, Grant Schoenebeck,\nhttps://proceedings.mlr.press/v216/burrell23a.html\n\n297   |   Validation of Composite Systems by Discrepancy Propagation   \nDavid Reeb, Kanil Patel, Karim Said Barsim, Martin Schiegg, Sebastian Gerwinn,\nhttps://proceedings.mlr.press/v216/reeb23a.html\n\n480   |   Investigating a Generalization of Probabilistic Material Implication and Bayesian Conditional   \nMatthias Scheutz, Michael Jahn.\nhttps://proceedings.mlr.press/v216/reeb23a.html",
  "duration": 662,
  "language": "eng",
  "recorded": "2023-07-31",
  "related_urls": [
    {
      "label": "Conference Website",
      "url": "https://www.auai.org/uai2023/"
    },
    {
      "label": "https://proceedings.mlr.press/v216/reeb23a.html",
      "url": "https://proceedings.mlr.press/v216/reeb23a.html"
    },
    {
      "label": "https://proceedings.mlr.press/v216/choo23a.html",
      "url": "https://proceedings.mlr.press/v216/choo23a.html"
    },
    {
      "label": "https://proceedings.mlr.press/v216/pan23a.html",
      "url": "https://proceedings.mlr.press/v216/pan23a.html"
    },
    {
      "label": "https://proceedings.mlr.press/v216/sun23c.html",
      "url": "https://proceedings.mlr.press/v216/sun23c.html"
    },
    {
      "label": "https://proceedings.mlr.press/v216/das23b.html",
      "url": "https://proceedings.mlr.press/v216/das23b.html"
    },
    {
      "label": "https://proceedings.mlr.press/v216/boyd23a.html",
      "url": "https://proceedings.mlr.press/v216/boyd23a.html"
    },
    {
      "label": "https://proceedings.mlr.press/v216/kim23b.html",
      "url": "https://proceedings.mlr.press/v216/kim23b.html"
    },
    {
      "label": "https://proceedings.mlr.press/v216/burrell23a.html",
      "url": "https://proceedings.mlr.press/v216/burrell23a.html"
    }
  ],
  "speakers": [
    "Taposh Banerjee",
    "Davin Choo",
    "Yeachan Kim",
    "Dongfang Sun",
    "Ling Pan",
    "Abhimanyu Das",
    "Alex James Boyd",
    "Noah Burrell",
    "David Reeb",
    "Matthias Scheutz"
  ],
  "tags": [],
  "thumbnail_url": "https://i.ytimg.com/vi/Oc2TpjhC01Y/maxresdefault.jpg",
  "title": "Poster Spotlights 2",
  "videos": [
    {
      "type": "youtube",
      "url": "https://www.youtube.com/watch?v=Oc2TpjhC01Y"
    }
  ]
}
