{
  "description": "Poster Spotlights 3 (session chair: Jakob Runge)\n\n79   |   BISCUIT: Causal Representation Learning from Binary Interactions   Phillip Lippe, Sara Magliacane, Sindy L\u00f6we, Yuki M Asano, Taco Cohen, Efstratios Gavves\nhttps://proceedings.mlr.press/v216/lippe23a.html\n\n257   |   Composing Efficient, Robust Tests for Policy Selection   Dustin Morrill, Thomas Walsh, Daniel Hernandez, Peter R. Wurman, Peter Stone\nhttps://proceedings.mlr.press/v216/morrill23a.html\n\n294   |   Nystr\u00f6m $M$-Hilbert-Schmidt Independence Criterion   Florian Kalinke, Zolt\u00e1n Szab\u00f3\nhttps://proceedings.mlr.press/v216/kalinke23a.html\n\n354   |   JANA: Jointly Amortized Neural Approximation of Complex Bayesian Models   Stefan T. Radev, Marvin Schmitt, Valentin Pratz, Umberto Picchini, Ullrich Koethe, Paul Buerkner\nhttps://proceedings.mlr.press/v216/radev23a.html\n\n476   |   Causal Inference With Outcome-Dependent Missingness And Self-Censoring   Jacob Morris Chen, Daniel Malinsky, Rohit Bhattacharya\nhttps://proceedings.mlr.press/v216/chen23f.html\n\n516   |   CUE: An Uncertainty Interpretation Framework for Text Classifiers Built on Pre-Trained Language Models   Jiazheng Li, ZHAOYUE SUN, Bin Liang, Lin Gui, Yulan He\nhttps://proceedings.mlr.press/v216/li23d.html\n\n556   |   Fast and Scalable Score-Based Kernel Calibration Tests   Pierre Glaser, David Widmann, Fredrik Lindsten, Arthur Gretton\nhttps://proceedings.mlr.press/v216/glaser23a.html\n\n559   |   \"Private Prediction Strikes Back!\" Private Kernelized Nearest Neighbors with Individual R\\'{e}nyi Filter   Yuqing Zhu, Xuandong Zhao, Chuan Guo, Yu-Xiang Wang\nhttps://proceedings.mlr.press/v216/zhu23b.html",
  "duration": 1015,
  "language": "eng",
  "recorded": "2023-07-31",
  "related_urls": [
    {
      "label": "Conference Website",
      "url": "https://www.auai.org/uai2023/"
    },
    {
      "label": "https://proceedings.mlr.press/v216/li23d.html",
      "url": "https://proceedings.mlr.press/v216/li23d.html"
    },
    {
      "label": "https://proceedings.mlr.press/v216/lippe23a.html",
      "url": "https://proceedings.mlr.press/v216/lippe23a.html"
    },
    {
      "label": "https://proceedings.mlr.press/v216/zhu23b.html",
      "url": "https://proceedings.mlr.press/v216/zhu23b.html"
    },
    {
      "label": "https://proceedings.mlr.press/v216/glaser23a.html",
      "url": "https://proceedings.mlr.press/v216/glaser23a.html"
    },
    {
      "label": "https://proceedings.mlr.press/v216/morrill23a.html",
      "url": "https://proceedings.mlr.press/v216/morrill23a.html"
    },
    {
      "label": "https://proceedings.mlr.press/v216/chen23f.html",
      "url": "https://proceedings.mlr.press/v216/chen23f.html"
    },
    {
      "label": "https://proceedings.mlr.press/v216/radev23a.html",
      "url": "https://proceedings.mlr.press/v216/radev23a.html"
    },
    {
      "label": "https://proceedings.mlr.press/v216/kalinke23a.html",
      "url": "https://proceedings.mlr.press/v216/kalinke23a.html"
    }
  ],
  "speakers": [
    "Jakob Runge",
    "Phillip Lippe",
    "Dustin Morrill",
    "Florian Kalinke",
    "Stefan T. Radev",
    "Jacob Morris Chen",
    "Jiazheng Li",
    "Pierre Glaser",
    "Yuqing Zhu"
  ],
  "tags": [],
  "thumbnail_url": "https://i.ytimg.com/vi/TsKTN8nCzbI/maxresdefault.jpg",
  "title": "Poster Spotlights 3",
  "videos": [
    {
      "type": "youtube",
      "url": "https://www.youtube.com/watch?v=TsKTN8nCzbI"
    }
  ]
}
