{
  "description": "Poster Spotlights 1 (session chair: Nicolas Gisolfi, all spotlights virtual)\n\n91   |   Quasi-Bayesian Nonparametric Density Estimation via Autoregressive Predictive Updates   Sahra Ghalebikesabi, Christopher C. Holmes, Edwin Fong, Brieuc Lehmann\nhttps://proceedings.mlr.press/v216/ghalebikesabi23a.html\n\n190   |   Conditional Counterfactual Causal Effect for Individual Attribution   \nRuiqi Zhao, lei zhang, Shengyu Zhu, Zitong Lu, Zhenhua Dong, Chaoliang Zhang, Jun Xu, Zhi Geng, Yangbo He,\nhttps://proceedings.mlr.press/v216/zhao23a.html\n\n196   |   Random Reshuffling with Variance Reduction: New Analysis and Better Rates   \nGrigory Malinovsky, Alibek Sailanbayev, Peter Richt\u00e1rik,\nhttps://proceedings.mlr.press/v216/malinovsky23a.html\n\n227   |   Multi-View Graph Contrastive Learning for Solving Vehicle Routing Problems   \nYuan Jiang, Zhiguang Cao, Yaoxin Wu, Jie Zhang,\nhttps://proceedings.mlr.press/v216/jiang23a.html\n\n303   |   MFA: Multi-scale Feature-aware Attack for Object Detection   \nWen Chen, Yushan Zhang, Zhiheng Li, Yuehuan Wang,\nhttps://proceedings.mlr.press/v216/chen23d.html\n\n325   |   Incentivising Diffusion while Preserving Differential Privacy   \nFengjuan Jia, Mengxiao Zhang, Jiamou Liu, Bakh Khoussainov,\nhttps://proceedings.mlr.press/v216/jia23a.html\n\n472   |   Residual-Based Error Bound for Physics-Informed Neural Networks   \nShuheng Liu, Xiyue Huang, Pavlos Protopapas,\nhttps://proceedings.mlr.press/v216/liu23b.html\n\n617   |   On the Informativeness of Supervision Signals   \nIlia Sucholutsky, Ruairidh McLennan Battleday, Katherine M. Collins, Raja Marjieh, Joshua Peterson, Pulkit Singh, Umang Bhatt, Nori Jacoby, Adrian Weller, Thomas L. Griffiths\nhttps://proceedings.mlr.press/v216/sucholutsky23a.html",
  "duration": 1088,
  "language": "eng",
  "recorded": "2023-07-31",
  "related_urls": [
    {
      "label": "Conference Website",
      "url": "https://www.auai.org/uai2023/"
    },
    {
      "label": "https://proceedings.mlr.press/v216/jia23a.html",
      "url": "https://proceedings.mlr.press/v216/jia23a.html"
    },
    {
      "label": "https://proceedings.mlr.press/v216/chen23d.html",
      "url": "https://proceedings.mlr.press/v216/chen23d.html"
    },
    {
      "label": "https://proceedings.mlr.press/v216/sucholutsky23a.html",
      "url": "https://proceedings.mlr.press/v216/sucholutsky23a.html"
    },
    {
      "label": "https://proceedings.mlr.press/v216/jiang23a.html",
      "url": "https://proceedings.mlr.press/v216/jiang23a.html"
    },
    {
      "label": "https://proceedings.mlr.press/v216/liu23b.html",
      "url": "https://proceedings.mlr.press/v216/liu23b.html"
    },
    {
      "label": "https://proceedings.mlr.press/v216/malinovsky23a.html",
      "url": "https://proceedings.mlr.press/v216/malinovsky23a.html"
    },
    {
      "label": "https://proceedings.mlr.press/v216/zhao23a.html",
      "url": "https://proceedings.mlr.press/v216/zhao23a.html"
    },
    {
      "label": "https://proceedings.mlr.press/v216/ghalebikesabi23a.html",
      "url": "https://proceedings.mlr.press/v216/ghalebikesabi23a.html"
    }
  ],
  "speakers": [
    "Nicolas Gisolfi",
    "Sahra Ghalebikesabi",
    "Ruiqi Zhao",
    "Grigory Malinovsky",
    "Yuan Jiang",
    "Wen Chen",
    "Fengjuan Jia",
    "Shuheng Liu",
    "Ilia Sucholutsky"
  ],
  "tags": [],
  "thumbnail_url": "https://i.ytimg.com/vi/O0T4rjLrJ5o/maxresdefault.jpg",
  "title": "Poster Spotlights 1",
  "videos": [
    {
      "type": "youtube",
      "url": "https://www.youtube.com/watch?v=O0T4rjLrJ5o"
    }
  ]
}
