{
  "description": "Speaker: Junpeng Lao\nTitle: Partial Missing Multivariate observation and what to do with them\nVideo: https://www.youtube.com/watch?v=nJ3XefApED0\n\nEvent description:\nMissing value is pretty common in any real world data set. While PyMC provides convenient automatic imputation, how do we verify it works, especially dealing with multivariate observation with partially missing value? Come to this tutorial to find out!\n\nDiscourse Discussion\nhttps://discourse.pymc.io/t/partial-missing-multivariate-observation-and-what-to-do-with-them-by-junpeng-lao/6050\n\n## Timestamps\n- 0:00 Start of event\n- x:xx \n- x:xx\n\n## Note: help us add timestamps here\nhttps://github.com/pymc-devs/video-timestamps\n\nSpeaker bio:\nJunpeng Lao is a PyMC developer and currently a data scientist at Google. He also contribute to TensorFlow Probability and varies other Open source libraries.\n\nSpeaker info:\n-Twitter: https://twitter.com/junpenglao\n-Github: https://github.com/junpenglao\n-Website: https://junpenglao.xyz/\n\nPart of PyMCon2020. \nMore details at http://www.pymcon.com  \n\n#bayesian #PyMC",
  "duration": 2505,
  "language": "eng",
  "recorded": "2020-10-31",
  "related_urls": [
    {
      "label": "Conference Website",
      "url": "https://pymc-devs.github.io/pymcon/"
    },
    {
      "label": "http://www.pymcon.com",
      "url": "http://www.pymcon.com"
    },
    {
      "label": "https://github.com/junpenglao",
      "url": "https://github.com/junpenglao"
    },
    {
      "label": "https://junpenglao.xyz/",
      "url": "https://junpenglao.xyz/"
    },
    {
      "label": "https://www.youtube.com/watch?v=nJ3XefApED0",
      "url": "https://www.youtube.com/watch?v=nJ3XefApED0"
    },
    {
      "label": "https://twitter.com/junpenglao",
      "url": "https://twitter.com/junpenglao"
    },
    {
      "label": "https://github.com/pymc-devs/video-timestamps",
      "url": "https://github.com/pymc-devs/video-timestamps"
    },
    {
      "label": "https://discourse.pymc.io/t/partial-missing-multivariate-observation-and-what-to-do-with-them-by-junpeng-lao/6050",
      "url": "https://discourse.pymc.io/t/partial-missing-multivariate-observation-and-what-to-do-with-them-by-junpeng-lao/6050"
    }
  ],
  "speakers": [
    "Junpeng Lao"
  ],
  "tags": [],
  "thumbnail_url": "https://i.ytimg.com/vi_webp/nJ3XefApED0/maxresdefault.webp",
  "title": "Partial Missing Multivariate observation and what to do with them",
  "videos": [
    {
      "type": "youtube",
      "url": "https://www.youtube.com/watch?v=nJ3XefApED0"
    }
  ]
}
