{
  "description": "Speaker: Max Sklar\n\nTitle: What is probability? A philosophical question with practical implications for Bayesians\n\nVideo: https://www.youtube.com/watch?v=cv2TvH7r6W0\n\n\n\nEvent description:\nThis talk will familiarize you with the philosophical questions of probability and the implications when it comes to justifying and explaining Bayesian models.\n\n\nDiscourse Discussion\nhttps://discourse.pymc.io/t/what-is-probability-a-philosophical-question-with-practical-implications-for-bayesians-by-max-sklar/5986\n\n## Timestamps\n00:00 Introduction by Max\n01:53 Assumptions regarding Bayesian knowledge\n02:58 What is probability?\n04:26 What this talk is about\n05:49 First example: Does the ad work or not?\n07:45 Another example: Election predictions\n09:00 Subjective probabilities and beliefs\n10:25 A probabilistic guess who\n12:07 The dominant frequentists view\n13:59 Controlled experiments\n16:06 Bernstein-von Mises theorem\n18:13 Exceptions to convergence\n19:55 Non-parametric methods\n20:29 Case vs class probability\n23:25 The chance of something that has never happend before\n24:02 Propensity theory\n25:55 Credible (bayesian) vs confidence (frequentists) intervals\n27:34 P-values\n28:24 Being aware of different views on probabilities\n28:53 Relative probability\n32:37 4 quick take aways\n\nSpeaker bio:\nMax Sklar is a machine learning engineer and a member of the innovation labs team at Foursquare. He hosts a weekly podcast called The Local Maximum which covers a broad range of current issues, including a focus on Bayesian Inference.\n\n\nSpeaker info: \n-GitHub: https://github.com/maxsklar\n-Twitter: https://twitter.com/maxsklar\n-Website: https://www.localmaxradio.com/\n-LinkedIn: https://www.linkedin.com/in/max-sklar-b638464\n\n\nPart of PyMCon2020. \nMore details at http://www.pymcon.com  \n\n\n#bayesian #probability #statistics",
  "duration": 2077,
  "language": "eng",
  "recorded": "2020-10-31",
  "related_urls": [
    {
      "label": "Conference Website",
      "url": "https://pymc-devs.github.io/pymcon/"
    },
    {
      "label": "http://www.pymcon.com",
      "url": "http://www.pymcon.com"
    },
    {
      "label": "https://www.youtube.com/watch?v=cv2TvH7r6W0",
      "url": "https://www.youtube.com/watch?v=cv2TvH7r6W0"
    },
    {
      "label": "https://twitter.com/maxsklar",
      "url": "https://twitter.com/maxsklar"
    },
    {
      "label": "https://www.linkedin.com/in/max-sklar-b638464",
      "url": "https://www.linkedin.com/in/max-sklar-b638464"
    },
    {
      "label": "https://discourse.pymc.io/t/what-is-probability-a-philosophical-question-with-practical-implications-for-bayesians-by-max-sklar/5986",
      "url": "https://discourse.pymc.io/t/what-is-probability-a-philosophical-question-with-practical-implications-for-bayesians-by-max-sklar/5986"
    },
    {
      "label": "https://www.localmaxradio.com/",
      "url": "https://www.localmaxradio.com/"
    },
    {
      "label": "https://github.com/maxsklar",
      "url": "https://github.com/maxsklar"
    }
  ],
  "speakers": [
    "Max Sklar"
  ],
  "tags": [],
  "thumbnail_url": "https://i.ytimg.com/vi_webp/cv2TvH7r6W0/maxresdefault.webp",
  "title": "What Is Probability? A Philosophical Question With Practical Implications for Bayesians",
  "videos": [
    {
      "type": "youtube",
      "url": "https://www.youtube.com/watch?v=cv2TvH7r6W0"
    }
  ]
}
