{
  "description": "Andrés Torres\n\n\nEHMSOFTWARE SAS\n\n\nSocial Networks:\n\nTwitter: https://twitter.com/elfotografo007\nGitHub: https://github.com/elfotografo007\nLinkedIn: https://www.linkedin.com/in/elfotografo007/\n\n\n\nProgramación en paralelo con Python: sácale jugo a los núcleos de tu computadora (Español)\n\n\nAhora más que nunca, personas de distintas áreas del conocimiento han aprendido a programar. Debido a su formación no técnica, los conceptos básicos de programación en paralelo son desconocidos y estamos perdiendo tiempo precioso de nuestras vidas al programar tareas largas de manera secuencial.\n\nEn esta charla cubriremos los conceptos básicos de programación en paralelo con Python y mostraremos lo fácil que es implementarlo en Python. También aclararemos ciertos mitos como que en Python no hay paralelismo real e introduciremos distintas herramientas para usar fácilmente programación en paralelo con Python. Se explicarán ciertas consideraciones que debemos tener en cuenta para crear programas que hagan procesamiento en paralelo. Finalmente introduciremos unos casos de estudio, por ejemplo, de cómo aplicar programación en paralelo para acelerar la evaluación de modelos de Machine Learning.\n\nOutline\n\nIntroducción (5 minutos)\n\nProblema: Todos tenemos acceso a distintos núcleos pero escribimos código que solamente utiliza un núcleo.\nEjemplos de tareas que podemos hacer en paralelo\nDemostración en vivo de cómo se usa en nuestra vida diaria: ejecutar una operación de IO que bloquea una interfaz gráfica VS. una que utiliza hilos cuya interfaz no se bloquea. Hilos y procesos (10 minutos)\nDefinición de hilos\nDefinición de procesos\nDiferencia entre hilos y procesos\nEl GIL en Python\nCuándo usar hilos y cuándo usar procesos\nSincronización\nMemoria compartida Paralelismo en Python (12 minutos)\nHilos (Módulo threading)\nProcesos (Módulo multiprocessing)\nPools y workers\nLibrería joblib Casos de estudio (7 minutos)\nProcesando XML en paralelo\nAcelerando classifier chain en scikit-learn\nEjecutar cross validation en paralelo Consideraciones (3 minutos)\nParalelismo introduce complejidad al sistema\nSincronización y tareas de corta duración pueden resultar en menor rendimiento\nCiertos problemas no escalan linealmente\nNo todos los problemas se pueden dividir fácilmente\nFrameworks como Spark y dask te dan paralelismo automático, dependiendo de la tarea. Preguntas (3 minutos)\nNB: En caso de ser necesario, la charla y las diapositivas pueden ser impartidas en inglés.\n\n\nWe want to say thanks to all our sponsors who helped make the conference a huge success.\n\n- Universidad EAFIT - http://www.eafit.edu.co/\n- Globant - https://www.globant.com/\n- Linode - https://www.linode.com/\n- Mercadolibre.com - https://www.mercadolibre.com.co/\n- monoku.com - https://monoku.com/\n- Playvox - https://www.playvox.com/\n- UruIT - https://uruit.com/\n- Elastic - https://www.elastic.co/es/\n- #The_Python_Software_Foundation - https://www.python.org/\n- Monadical - https://monadical.com/\n- Fluid Attacks - https://fluidattacks.com/\n- Swapps - https://swapps.com/\n- TributiOnline - https://www.tributi.com/\n- VanHack - https://vanhack.com/\n- Avanet - http://avanet.org/\n- Cafeto Software - https://cafeto.co/\n- OmniBnk - https://omnibnk.com/\n- AutonomicMind - https://autonomicmind.com/\n- #AIFund - https://aifund.ai/  \n\nFollow us\n\nFacebook: https://www.facebook.com/pyconcolombia\nTwitter: https://twitter.com/pyconcolombia\nInstagram:  https://www.instagram.com/pyconcolombia/\nTelegram: https://t.me/pyconcolombia\nLinkedIn: https://www.linkedin.com/company/pycon-colombia/\nFlickr: https://www.flickr.com/photos/pyconcolombia/\n\nMore About PyCon Colombia in http://www.pycon.co",
  "duration": 1950,
  "language": "spa",
  "recorded": "2020-02-07",
  "related_urls": [
    {
      "label": "Conference Website",
      "url": "https://2020.pycon.co/"
    },
    {
      "label": "https://cafeto.co/",
      "url": "https://cafeto.co/"
    },
    {
      "label": "https://www.mercadolibre.com.co/",
      "url": "https://www.mercadolibre.com.co/"
    },
    {
      "label": "https://www.linkedin.com/company/pycon-colombia/",
      "url": "https://www.linkedin.com/company/pycon-colombia/"
    },
    {
      "label": "http://www.eafit.edu.co/",
      "url": "http://www.eafit.edu.co/"
    },
    {
      "label": "https://vanhack.com/",
      "url": "https://vanhack.com/"
    },
    {
      "label": "https://swapps.com/",
      "url": "https://swapps.com/"
    },
    {
      "label": "https://twitter.com/elfotografo007",
      "url": "https://twitter.com/elfotografo007"
    },
    {
      "label": "https://www.globant.com/",
      "url": "https://www.globant.com/"
    },
    {
      "label": "https://aifund.ai/",
      "url": "https://aifund.ai/"
    },
    {
      "label": "https://www.facebook.com/pyconcolombia",
      "url": "https://www.facebook.com/pyconcolombia"
    },
    {
      "label": "https://www.elastic.co/es/",
      "url": "https://www.elastic.co/es/"
    },
    {
      "label": "https://t.me/pyconcolombia",
      "url": "https://t.me/pyconcolombia"
    },
    {
      "label": "https://omnibnk.com/",
      "url": "https://omnibnk.com/"
    },
    {
      "label": "https://www.python.org/",
      "url": "https://www.python.org/"
    },
    {
      "label": "https://monadical.com/",
      "url": "https://monadical.com/"
    },
    {
      "label": "https://www.flickr.com/photos/pyconcolombia/",
      "url": "https://www.flickr.com/photos/pyconcolombia/"
    },
    {
      "label": "https://www.linkedin.com/in/elfotografo007/",
      "url": "https://www.linkedin.com/in/elfotografo007/"
    },
    {
      "label": "https://www.playvox.com/",
      "url": "https://www.playvox.com/"
    },
    {
      "label": "http://avanet.org/",
      "url": "http://avanet.org/"
    },
    {
      "label": "https://monoku.com/",
      "url": "https://monoku.com/"
    },
    {
      "label": "https://fluidattacks.com/",
      "url": "https://fluidattacks.com/"
    },
    {
      "label": "https://www.linode.com/",
      "url": "https://www.linode.com/"
    },
    {
      "label": "http://www.pycon.co",
      "url": "http://www.pycon.co"
    },
    {
      "label": "https://twitter.com/pyconcolombia",
      "url": "https://twitter.com/pyconcolombia"
    },
    {
      "label": "https://github.com/elfotografo007",
      "url": "https://github.com/elfotografo007"
    },
    {
      "label": "https://uruit.com/",
      "url": "https://uruit.com/"
    },
    {
      "label": "https://www.instagram.com/pyconcolombia/",
      "url": "https://www.instagram.com/pyconcolombia/"
    },
    {
      "label": "https://www.tributi.com/",
      "url": "https://www.tributi.com/"
    },
    {
      "label": "https://autonomicmind.com/",
      "url": "https://autonomicmind.com/"
    }
  ],
  "speakers": [
    "Andrés Torres"
  ],
  "tags": [],
  "thumbnail_url": "https://i.ytimg.com/vi_webp/Wv4R7H-HPTo/maxresdefault.webp",
  "title": "Programación en paralelo con Python: sácale jugo a los núcleos de tu computadora",
  "videos": [
    {
      "type": "youtube",
      "url": "https://www.youtube.com/watch?v=Wv4R7H-HPTo"
    }
  ]
}
