{
  "description": "Camilo Cardona\n\n\nNTT\n\n\nSocial Networks:\n\nLinkedIn: https://www.linkedin.com/in/juan-camilo-cardona-restrepo-9861932b/\n\n\nDesarrollo de Dashboards interactivos en Jupyter para personas desinteresadas en interfaces gráficas (Español)\n\n\n\"El objetivo de esta charla es explicar cómo construir prototipos de interfaces de usuario interactivas utilizando python y el proyecto jupyter. Describiré las herramientas básicas disponibles, y mostraré como utilizarlas para construir dashboards interactivos (con visualización de datos, botones, listas, etc) de diversa complejidad.\n\nLa creación de prototipos completos (i.e. “end-to-end”) son muy utilices en las fases iniciales de muchos proyectos. Las interfaces de usuario (e.g. el UI) deberían ser parte de estos prototipos desde el primer momento. Sin embargo, el desarrollo de estas requiere de conocimiento de conceptos o frameworks especializados y alejados de las utilizadas en el “backend”. Muchas veces inclusive, existen personas en los grupos dedicadas solamente al desarrollo de estos elementos.\n\nPara algunos de nosotros, como programadores de Python, nos gustaría poder construir estos prototipos sin necesidad de salir de nuestro ambiente de desarrollo. De esta manera podemos comunicar mejor nuestras ideas, y ser influyentes en la creación del producto, sin tener que aprender una cantidad enorme de nuevas tecnologías o depender de terceras personas.\n\nPor suerte, el proyecto jupyter cuenta con un conjunto de herramientas que nos pueden permitir crear prototipos de dashboards interactivos con relativa facilidad. Las librerías han llegado a un punto de maduración en donde es posible construir UIs relativamente complejos sin necesidad de conocimientos extensos del código interno de estas herramientas.\n\nEn esta charla explicare algunas de estas herramientas. Comentare un poco de mi experiencia empleándolas, y, utilizando datasets ficticios, ilustraré varios ejemplos de dashboards similares a los que he tenido que construir en mi trabajo. \"\n\n\nWe want to say thanks to all our sponsors who helped make the conference a huge success.\n\n- Universidad EAFIT - http://www.eafit.edu.co/\n- Globant - https://www.globant.com/\n- Linode - https://www.linode.com/\n- Mercadolibre.com - https://www.mercadolibre.com.co/\n- monoku.com - https://monoku.com/\n- Playvox - https://www.playvox.com/\n- UruIT - https://uruit.com/\n- Elastic - https://www.elastic.co/es/\n- #The_Python_Software_Foundation - https://www.python.org/\n- Monadical - https://monadical.com/\n- Fluid Attacks - https://fluidattacks.com/\n- Swapps - https://swapps.com/\n- TributiOnline - https://www.tributi.com/\n- VanHack - https://vanhack.com/\n- Avanet - http://avanet.org/\n- Cafeto Software - https://cafeto.co/\n- OmniBnk - https://omnibnk.com/\n- AutonomicMind - https://autonomicmind.com/\n- #AIFund - https://aifund.ai/  \n\nFollow us\n\nFacebook: https://www.facebook.com/pyconcolombia\nTwitter: https://twitter.com/pyconcolombia\nInstagram:  https://www.instagram.com/pyconcolombia/\nTelegram: https://t.me/pyconcolombia\nLinkedIn: https://www.linkedin.com/company/pycon-colombia/\nFlickr: https://www.flickr.com/photos/pyconcolombia/\n\nMore About PyCon Colombia in http://www.pycon.co",
  "duration": 1826,
  "language": "spa",
  "recorded": "2020-02-07",
  "related_urls": [
    {
      "label": "Conference Website",
      "url": "https://2020.pycon.co/"
    },
    {
      "label": "https://cafeto.co/",
      "url": "https://cafeto.co/"
    },
    {
      "label": "https://www.mercadolibre.com.co/",
      "url": "https://www.mercadolibre.com.co/"
    },
    {
      "label": "https://www.linkedin.com/company/pycon-colombia/",
      "url": "https://www.linkedin.com/company/pycon-colombia/"
    },
    {
      "label": "http://www.eafit.edu.co/",
      "url": "http://www.eafit.edu.co/"
    },
    {
      "label": "https://vanhack.com/",
      "url": "https://vanhack.com/"
    },
    {
      "label": "https://swapps.com/",
      "url": "https://swapps.com/"
    },
    {
      "label": "https://www.globant.com/",
      "url": "https://www.globant.com/"
    },
    {
      "label": "https://aifund.ai/",
      "url": "https://aifund.ai/"
    },
    {
      "label": "https://www.linkedin.com/in/juan-camilo-cardona-restrepo-9861932b/",
      "url": "https://www.linkedin.com/in/juan-camilo-cardona-restrepo-9861932b/"
    },
    {
      "label": "https://www.facebook.com/pyconcolombia",
      "url": "https://www.facebook.com/pyconcolombia"
    },
    {
      "label": "https://www.elastic.co/es/",
      "url": "https://www.elastic.co/es/"
    },
    {
      "label": "https://t.me/pyconcolombia",
      "url": "https://t.me/pyconcolombia"
    },
    {
      "label": "https://omnibnk.com/",
      "url": "https://omnibnk.com/"
    },
    {
      "label": "https://www.python.org/",
      "url": "https://www.python.org/"
    },
    {
      "label": "https://monadical.com/",
      "url": "https://monadical.com/"
    },
    {
      "label": "https://www.flickr.com/photos/pyconcolombia/",
      "url": "https://www.flickr.com/photos/pyconcolombia/"
    },
    {
      "label": "https://www.playvox.com/",
      "url": "https://www.playvox.com/"
    },
    {
      "label": "http://avanet.org/",
      "url": "http://avanet.org/"
    },
    {
      "label": "https://monoku.com/",
      "url": "https://monoku.com/"
    },
    {
      "label": "https://fluidattacks.com/",
      "url": "https://fluidattacks.com/"
    },
    {
      "label": "https://www.linode.com/",
      "url": "https://www.linode.com/"
    },
    {
      "label": "http://www.pycon.co",
      "url": "http://www.pycon.co"
    },
    {
      "label": "https://twitter.com/pyconcolombia",
      "url": "https://twitter.com/pyconcolombia"
    },
    {
      "label": "https://uruit.com/",
      "url": "https://uruit.com/"
    },
    {
      "label": "https://www.instagram.com/pyconcolombia/",
      "url": "https://www.instagram.com/pyconcolombia/"
    },
    {
      "label": "https://www.tributi.com/",
      "url": "https://www.tributi.com/"
    },
    {
      "label": "https://autonomicmind.com/",
      "url": "https://autonomicmind.com/"
    }
  ],
  "speakers": [
    "Camilo Cardona"
  ],
  "tags": [],
  "thumbnail_url": "https://i.ytimg.com/vi_webp/BB589En-aFg/maxresdefault.webp",
  "title": "Desarrollo de Dashboards interactivos en Jupyter",
  "videos": [
    {
      "type": "youtube",
      "url": "https://www.youtube.com/watch?v=BB589En-aFg"
    }
  ]
}
