{
  "description": "Gustavo angulo\n\n\nUbidots\n\n\nSocial Networks:\n\nTwitter: https://twitter.com/woakas\nGitHub: https://github.com/woakas\nLinkedIn: https://www.linkedin.com/in/woakas/\n\n\nAntes mi servicio se demoraba 5 seg y ahora 300 miliseg, veamos que es profiling en diferentes capas, Base de datos, aplicación, cache, mobile, para llevar a tus aplicaciones a otro nivel de velocidad. (Español)\n\n\nEsta charla es para un público intermedio-avanzado.\n\nSe realizará en dos secciones (Optimizaciones y posibles degradaciones) y muestra como se realiza profiling de aplicaciones en ambientes de desarrollo y luego como se puede realizar optimizaciones en producción, reduciendo tiempos de respuesta en diferentes capas (Base de datos, aplicación, cache, contenido estático) En cada capa se mostrará un ejemplo normal de uso y el tiempo de consumo en respuesta en un ambiente de producción y luego con la optimización como se encuentran cambios y se optimiza reduciendo tiempo, memoria o CPU de uso..\n\nLuego seguirá una sección de como identificar, encontrar y monitorear degradamientos de sistemas en producción y por que es tan importante el profiling, ahorrando dinero en sistemas de producción.\n\nSe usará como base para el taller flask y django, y se abordará otros frameworks como Sanic.\n\n\nWe want to say thanks to all our sponsors who helped make the conference a huge success.\n\n- Universidad EAFIT - http://www.eafit.edu.co/\n- Globant - https://www.globant.com/\n- Linode - https://www.linode.com/\n- Mercadolibre.com - https://www.mercadolibre.com.co/\n- monoku.com - https://monoku.com/\n- Playvox - https://www.playvox.com/\n- UruIT - https://uruit.com/\n- Elastic - https://www.elastic.co/es/\n- #The_Python_Software_Foundation - https://www.python.org/\n- Monadical - https://monadical.com/\n- Fluid Attacks - https://fluidattacks.com/\n- Swapps - https://swapps.com/\n- TributiOnline - https://www.tributi.com/\n- VanHack - https://vanhack.com/\n- Avanet - http://avanet.org/\n- Cafeto Software - https://cafeto.co/\n- OmniBnk - https://omnibnk.com/\n- AutonomicMind - https://autonomicmind.com/\n- #AIFund - https://aifund.ai/  \n\nFollow us\n\nFacebook: https://www.facebook.com/pyconcolombia\nTwitter: https://twitter.com/pyconcolombia\nInstagram:  https://www.instagram.com/pyconcolombia/\nTelegram: https://t.me/pyconcolombia\nLinkedIn: https://www.linkedin.com/company/pycon-colombia/\nFlickr: https://www.flickr.com/photos/pyconcolombia/\n\nMore About PyCon Colombia in http://www.pycon.co",
  "duration": 1666,
  "language": "spa",
  "recorded": "2020-02-07",
  "related_urls": [
    {
      "label": "Conference Website",
      "url": "https://2020.pycon.co/"
    },
    {
      "label": "https://cafeto.co/",
      "url": "https://cafeto.co/"
    },
    {
      "label": "https://www.mercadolibre.com.co/",
      "url": "https://www.mercadolibre.com.co/"
    },
    {
      "label": "https://www.linkedin.com/company/pycon-colombia/",
      "url": "https://www.linkedin.com/company/pycon-colombia/"
    },
    {
      "label": "http://www.eafit.edu.co/",
      "url": "http://www.eafit.edu.co/"
    },
    {
      "label": "https://vanhack.com/",
      "url": "https://vanhack.com/"
    },
    {
      "label": "https://swapps.com/",
      "url": "https://swapps.com/"
    },
    {
      "label": "https://www.linkedin.com/in/woakas/",
      "url": "https://www.linkedin.com/in/woakas/"
    },
    {
      "label": "https://www.globant.com/",
      "url": "https://www.globant.com/"
    },
    {
      "label": "https://github.com/woakas",
      "url": "https://github.com/woakas"
    },
    {
      "label": "https://aifund.ai/",
      "url": "https://aifund.ai/"
    },
    {
      "label": "https://twitter.com/woakas",
      "url": "https://twitter.com/woakas"
    },
    {
      "label": "https://www.facebook.com/pyconcolombia",
      "url": "https://www.facebook.com/pyconcolombia"
    },
    {
      "label": "https://www.elastic.co/es/",
      "url": "https://www.elastic.co/es/"
    },
    {
      "label": "https://t.me/pyconcolombia",
      "url": "https://t.me/pyconcolombia"
    },
    {
      "label": "https://omnibnk.com/",
      "url": "https://omnibnk.com/"
    },
    {
      "label": "https://www.python.org/",
      "url": "https://www.python.org/"
    },
    {
      "label": "https://monadical.com/",
      "url": "https://monadical.com/"
    },
    {
      "label": "https://www.flickr.com/photos/pyconcolombia/",
      "url": "https://www.flickr.com/photos/pyconcolombia/"
    },
    {
      "label": "https://www.playvox.com/",
      "url": "https://www.playvox.com/"
    },
    {
      "label": "http://avanet.org/",
      "url": "http://avanet.org/"
    },
    {
      "label": "https://monoku.com/",
      "url": "https://monoku.com/"
    },
    {
      "label": "https://fluidattacks.com/",
      "url": "https://fluidattacks.com/"
    },
    {
      "label": "https://www.linode.com/",
      "url": "https://www.linode.com/"
    },
    {
      "label": "http://www.pycon.co",
      "url": "http://www.pycon.co"
    },
    {
      "label": "https://twitter.com/pyconcolombia",
      "url": "https://twitter.com/pyconcolombia"
    },
    {
      "label": "https://uruit.com/",
      "url": "https://uruit.com/"
    },
    {
      "label": "https://www.instagram.com/pyconcolombia/",
      "url": "https://www.instagram.com/pyconcolombia/"
    },
    {
      "label": "https://www.tributi.com/",
      "url": "https://www.tributi.com/"
    },
    {
      "label": "https://autonomicmind.com/",
      "url": "https://autonomicmind.com/"
    }
  ],
  "speakers": [
    "Gustavo Angulo"
  ],
  "tags": [],
  "thumbnail_url": "https://i.ytimg.com/vi_webp/w5t329sOY_g/maxresdefault.webp",
  "title": "Antes mi servicio se demoraba 5 seg y ahora 300 miliseg",
  "videos": [
    {
      "type": "youtube",
      "url": "https://www.youtube.com/watch?v=w5t329sOY_g"
    }
  ]
}
