{
  "description": "Sebastián Arango\n\n\nExperimentality\n\n\nSocial Networks:\n\nTwitter: https://twitter.com/charangostation\nLinkedIn: https://www.linkedin.com/in/sebastian-arango-dev/\n\n\nEnhancing Data Privacy through Federated (Machine) Learning (Español)\n\n\n\"Standard machine learning approaches require centralizing the training data in a central data store. Now for models trained from user interaction with mobile and IoT devices, there is an additional approach: Federated Learning.\n\nThis enables mobile devices to collaboratively learn a shared prediction model while keeping all the training data on device, decoupling the ability to do Machine Learning from the need to store the data in the cloud. This goes beyond the use of local models that make predictions on mobile devices by bringing model training to the device as well. Federated Learning thus allows for smarter models, lower latency, and less power consumption, all while ensuring privacy\".\n\nThis talk aims at explaining the fundamentals behind implementing Federated Learning capabilities, along with presenting some Python tools which serve to this purpose.\n\nEl objetivo principal es encontrar dominios relacionados semánticamente solamente usando información de consultas DNS sin ningún otro conocimiento sobre el contenido de esos dominios.\n\nLos resultados presentados pueden ser útiles en muchas actividades de ingeniería, con aplicación práctica en muchas áreas. Algunos ejemplos incluyen recomendaciones de sitios web, análisis competitivo, identificación de sitios riesgosos o fraudulentos, sistemas de control parental, mejoras de UX (basada en recomendaciones, corrección ortográfica, etc.), análisis de flujo de clics, representación y clustering de perfiles de navegación de usuarios, optimización de sistemas de cache en resolutores de DNS recursivos (entre otros).\n\nComo contribución a la comunidad, se libera un modelo pre-entrenado del DNS-VSM para usar en Python, a través de la conocida librería Gensim. El mismo puede descargarse a través de la página github en https://github.com/dns-vsm/embeddings . Con esto se espera que más trabajos e investigaciones puedan realizarse usando este modelo.\n\n\nWe want to say thanks to all our sponsors who helped make the conference a huge success.\n\n- Universidad EAFIT - http://www.eafit.edu.co/\n- Globant - https://www.globant.com/\n- Linode - https://www.linode.com/\n- Mercadolibre.com - https://www.mercadolibre.com.co/\n- monoku.com - https://monoku.com/\n- Playvox - https://www.playvox.com/\n- UruIT - https://uruit.com/\n- Elastic - https://www.elastic.co/es/\n- #The_Python_Software_Foundation - https://www.python.org/\n- Monadical - https://monadical.com/\n- Fluid Attacks - https://fluidattacks.com/\n- Swapps - https://swapps.com/\n- TributiOnline - https://www.tributi.com/\n- VanHack - https://vanhack.com/\n- Avanet - http://avanet.org/\n- Cafeto Software - https://cafeto.co/\n- OmniBnk - https://omnibnk.com/\n- AutonomicMind - https://autonomicmind.com/\n- #AIFund - https://aifund.ai/  \n\nFollow us\n\nFacebook: https://www.facebook.com/pyconcolombia\nTwitter: https://twitter.com/pyconcolombia\nInstagram:  https://www.instagram.com/pyconcolombia/\nTelegram: https://t.me/pyconcolombia\nLinkedIn: https://www.linkedin.com/company/pycon-colombia/\nFlickr: https://www.flickr.com/photos/pyconcolombia/\n\nMore About PyCon Colombia in http://www.pycon.co",
  "duration": 1722,
  "language": "spa",
  "recorded": "2020-02-07",
  "related_urls": [
    {
      "label": "Conference Website",
      "url": "https://2020.pycon.co/"
    },
    {
      "label": "https://cafeto.co/",
      "url": "https://cafeto.co/"
    },
    {
      "label": "https://www.mercadolibre.com.co/",
      "url": "https://www.mercadolibre.com.co/"
    },
    {
      "label": "https://www.linkedin.com/company/pycon-colombia/",
      "url": "https://www.linkedin.com/company/pycon-colombia/"
    },
    {
      "label": "http://www.eafit.edu.co/",
      "url": "http://www.eafit.edu.co/"
    },
    {
      "label": "https://vanhack.com/",
      "url": "https://vanhack.com/"
    },
    {
      "label": "https://swapps.com/",
      "url": "https://swapps.com/"
    },
    {
      "label": "https://www.globant.com/",
      "url": "https://www.globant.com/"
    },
    {
      "label": "https://aifund.ai/",
      "url": "https://aifund.ai/"
    },
    {
      "label": "https://www.facebook.com/pyconcolombia",
      "url": "https://www.facebook.com/pyconcolombia"
    },
    {
      "label": "https://www.elastic.co/es/",
      "url": "https://www.elastic.co/es/"
    },
    {
      "label": "https://t.me/pyconcolombia",
      "url": "https://t.me/pyconcolombia"
    },
    {
      "label": "https://omnibnk.com/",
      "url": "https://omnibnk.com/"
    },
    {
      "label": "https://www.linkedin.com/in/sebastian-arango-dev/",
      "url": "https://www.linkedin.com/in/sebastian-arango-dev/"
    },
    {
      "label": "https://www.python.org/",
      "url": "https://www.python.org/"
    },
    {
      "label": "https://monadical.com/",
      "url": "https://monadical.com/"
    },
    {
      "label": "https://www.flickr.com/photos/pyconcolombia/",
      "url": "https://www.flickr.com/photos/pyconcolombia/"
    },
    {
      "label": "https://github.com/dns-vsm/embeddings",
      "url": "https://github.com/dns-vsm/embeddings"
    },
    {
      "label": "https://www.playvox.com/",
      "url": "https://www.playvox.com/"
    },
    {
      "label": "http://avanet.org/",
      "url": "http://avanet.org/"
    },
    {
      "label": "https://monoku.com/",
      "url": "https://monoku.com/"
    },
    {
      "label": "https://fluidattacks.com/",
      "url": "https://fluidattacks.com/"
    },
    {
      "label": "https://www.linode.com/",
      "url": "https://www.linode.com/"
    },
    {
      "label": "http://www.pycon.co",
      "url": "http://www.pycon.co"
    },
    {
      "label": "https://twitter.com/pyconcolombia",
      "url": "https://twitter.com/pyconcolombia"
    },
    {
      "label": "https://uruit.com/",
      "url": "https://uruit.com/"
    },
    {
      "label": "https://twitter.com/charangostation",
      "url": "https://twitter.com/charangostation"
    },
    {
      "label": "https://www.instagram.com/pyconcolombia/",
      "url": "https://www.instagram.com/pyconcolombia/"
    },
    {
      "label": "https://www.tributi.com/",
      "url": "https://www.tributi.com/"
    },
    {
      "label": "https://autonomicmind.com/",
      "url": "https://autonomicmind.com/"
    }
  ],
  "speakers": [
    "Sebastián Arango"
  ],
  "tags": [],
  "thumbnail_url": "https://i.ytimg.com/vi_webp/mEPw36JE_8w/maxresdefault.webp",
  "title": "Enhancing Data Privacy through Federated (Machine) Learning",
  "videos": [
    {
      "type": "youtube",
      "url": "https://www.youtube.com/watch?v=mEPw36JE_8w"
    }
  ]
}
