{
  "description": "Título: Cultura Open Source: el qué, cómo y por qué\n\nSe dará una charla corta y dinámica, en la cual se muestran varios aspectos culturales del Open Source, explicando su historia, sus creadores y mencionando los detalles menos conocidos y más graciosos de miembros de la comunidad.\n\nFinalmente se habla de Open Source UC y su rol en la comunidad universitaria.\n\nPonente: Fernando Smith y Agustín Covarrubias\n\nContacto Fernando Smith:\nhttps://www.linkedin.com/in/fernando-smith/\nhttps://osuc.dev/\n\nContacto Agustín Covarrubias:\nhttps://twitter.com/austinc3301\nhttps://linkedin.com/in/agucova\nhttps://agucova.dev/\nhttps://americatransparente.org/\n\n----------------------------------------------------------------------------------------------------------------------------------------------------\n\n\nPyCon Chile 2022 - https://pycon.cl/\n\n\nPyCon Chile es un evento gratuito organizado por la comunidad Python Chile, para promover la divulgación y enseñanza de Python. Esta conferencia busca reunir a todos los entusiastas de Python, desde principiantes hasta usuarios avanzados, para compartir distintas temáticas relacionadas al lenguaje.\n\n\nSi te interesa utilizar Python en áreas tan variadas como ciencia de datos, inteligencia artificial, astronomía, geología, optimización matemática o ciencias sociales, entre otras, ¡este evento te encantará!\n\n\n★ ¡Únete a la comunidad! ★\n\n\n• Twitter: https://twitter.com/pythonchiledev\n• Facebook: https://www.facebook.com/groups/pytho...\n• Telegram: https://t.me/pythonchile\n• Discord: https://discord.gg/dTHMfJvauS",
  "duration": 2267,
  "language": "spa",
  "recorded": "2022-12-02",
  "related_urls": [
    {
      "label": "Conference Website",
      "url": "https://pycon.cl/2022/"
    },
    {
      "label": "https://twitter.com/austinc3301",
      "url": "https://twitter.com/austinc3301"
    },
    {
      "label": "https://agucova.dev/",
      "url": "https://agucova.dev/"
    },
    {
      "label": "https://twitter.com/pythonchiledev",
      "url": "https://twitter.com/pythonchiledev"
    },
    {
      "label": "https://www.facebook.com/groups/pytho...",
      "url": "https://www.facebook.com/groups/pytho..."
    },
    {
      "label": "https://americatransparente.org/",
      "url": "https://americatransparente.org/"
    },
    {
      "label": "https://osuc.dev/",
      "url": "https://osuc.dev/"
    },
    {
      "label": "https://pycon.cl/",
      "url": "https://pycon.cl/"
    },
    {
      "label": "https://linkedin.com/in/agucova",
      "url": "https://linkedin.com/in/agucova"
    },
    {
      "label": "https://www.linkedin.com/in/fernando-smith/",
      "url": "https://www.linkedin.com/in/fernando-smith/"
    },
    {
      "label": "https://t.me/pythonchile",
      "url": "https://t.me/pythonchile"
    },
    {
      "label": "https://discord.gg/dTHMfJvauS",
      "url": "https://discord.gg/dTHMfJvauS"
    }
  ],
  "speakers": [
    "Fernando Smith",
    "Agustín Covarrubias"
  ],
  "tags": [],
  "thumbnail_url": "https://i.ytimg.com/vi/CRwmIBaLd8w/maxresdefault.jpg",
  "title": "Cultura Open Source: el qué, cómo y por qué",
  "videos": [
    {
      "type": "youtube",
      "url": "https://www.youtube.com/watch?v=CRwmIBaLd8w"
    }
  ]
}
