{
  "description": "Título: Haciendo mapas con Python\n\n\nEn esta charla hablaré sobre las librerías que existen en Python para hacer análisis y visualización de datos geoespaciales. La charla abordará los principios básicos de la ciencia de datos espaciales y sus áreas de aplicación. También mostraré cómo de forma sencilla y en poco tiempo se pueden hacer mapas interactivos que pueden incluirse dentro de aplicaciones o proyectos y que pueden ser personalizados de forma sencilla para que se vean con un acabado más profesional.\n\n\nPonente: Steph Orellana\n\n\nContacto:\nhttps://twitter.com/sporella\nhttps://sporella.xyz/\nhttps://www.instagram.com/sporella.dev/\n----------------------------------------------------------------------------------------------------------------------------------------------------\n\n\n\n\nPyCon Chile 2022 - https://pycon.cl/\n\n\n\n\nPyCon Chile es un evento gratuito organizado por la comunidad Python Chile, para promover la divulgación y enseñanza de Python. Esta conferencia busca reunir a todos los entusiastas de Python, desde principiantes hasta usuarios avanzados, para compartir distintas temáticas relacionadas al lenguaje.\n\n\n\n\nSi te interesa utilizar Python en áreas tan variadas como ciencia de datos, inteligencia artificial, astronomía, geología, optimización matemática o ciencias sociales, entre otras, ¡este evento te encantará!\n\n\n\n\n★ ¡Únete a la comunidad! ★\n\n\n\n\n• Twitter: https://twitter.com/pythonchiledev\n• Facebook: https://www.facebook.com/groups/pytho...\n• Telegram: https://t.me/pythonchile\n• Discord: https://discord.gg/dTHMfJvauS",
  "duration": 1909,
  "language": "spa",
  "recorded": "2022-12-02",
  "related_urls": [
    {
      "label": "Conference Website",
      "url": "https://pycon.cl/2022/"
    },
    {
      "label": "https://www.instagram.com/sporella.dev/",
      "url": "https://www.instagram.com/sporella.dev/"
    },
    {
      "label": "https://twitter.com/pythonchiledev",
      "url": "https://twitter.com/pythonchiledev"
    },
    {
      "label": "https://twitter.com/sporella",
      "url": "https://twitter.com/sporella"
    },
    {
      "label": "https://www.facebook.com/groups/pytho...",
      "url": "https://www.facebook.com/groups/pytho..."
    },
    {
      "label": "https://sporella.xyz/",
      "url": "https://sporella.xyz/"
    },
    {
      "label": "https://pycon.cl/",
      "url": "https://pycon.cl/"
    },
    {
      "label": "https://t.me/pythonchile",
      "url": "https://t.me/pythonchile"
    },
    {
      "label": "https://discord.gg/dTHMfJvauS",
      "url": "https://discord.gg/dTHMfJvauS"
    }
  ],
  "speakers": [
    "Steph Orellana"
  ],
  "tags": [],
  "thumbnail_url": "https://i.ytimg.com/vi_webp/4uGFYvOTtdU/maxresdefault.webp",
  "title": "Haciendo mapas con Python",
  "videos": [
    {
      "type": "youtube",
      "url": "https://www.youtube.com/watch?v=4uGFYvOTtdU"
    }
  ]
}
