{
  "description": "*Charla: El arte de extender Python con otros lenguajes*\n\nKeynote PyCon Chile 2023, Domingo 26 Noviembre 2023.\n\nCristián trabaja como Sr. R&D Manager en The Qt Company. En su día a día trabaja con C++, Python y CPython, que suelen ser los temas de sus charlas. En su tiempo libre le gusta colaborar con comunidades Open Source, principalmente Python, como Python en Español https://hablemospython.dev, Python Chile https://pythonchile.cl, Python España https://es.python.org, PyLadies Berlin https://berlin.pyladies.com y conferencias como PyConUS, PyLadiesCon, Europython, ¡y muchas más!\n\nEn esta interesantísima charla, Cristián muestra como distintos lenguaje de programación ofrecen la posibilidad de extender Python, y casos actuales a los cuales se les puede atribuir su popularidad.  Se presentan ejemplos prácticos de extensiones en C++, Rust, mencionando otros casos con Lua, Zig, entre otros.\n\n----\n\nPyCon Chile 2023 - https://pycon.cl/\n\nPyCon Chile es un evento gratuito organizado por la comunidad Python Chile, para promover la divulgación y enseñanza de Python. Esta conferencia busca reunir a todos los entusiastas de Python, desde principiantes hasta usuarios avanzados, para compartir distintas temáticas relacionadas al lenguaje.\n\nSi te interesa utilizar Python en áreas tan variadas como ciencia de datos, inteligencia artificial, astronomía, geología, optimización matemática o ciencias sociales, entre otras, ¡este evento te encantará!\n\n----\n\n★ ¡Únete a la comunidad PythonChile! ★\n\n• Twitter: https://twitter.com/pythonchiledev\n• Facebook: https://www.facebook.com/groups/pytho...\n• Telegram: https://t.me/pythonchile\n• Discord: https://discord.gg/dTHMfJvauS",
  "duration": 3586,
  "language": "spa",
  "recorded": "2022-11-24",
  "related_urls": [
    {
      "label": "Conference Website",
      "url": "https://pycon.cl/2023/"
    },
    {
      "label": "https://pythonchile.cl,",
      "url": "https://pythonchile.cl,"
    },
    {
      "label": "https://hablemospython.dev,",
      "url": "https://hablemospython.dev,"
    },
    {
      "label": "https://twitter.com/pythonchiledev",
      "url": "https://twitter.com/pythonchiledev"
    },
    {
      "label": "https://www.facebook.com/groups/pytho...",
      "url": "https://www.facebook.com/groups/pytho..."
    },
    {
      "label": "https://berlin.pyladies.com",
      "url": "https://berlin.pyladies.com"
    },
    {
      "label": "https://es.python.org,",
      "url": "https://es.python.org,"
    },
    {
      "label": "https://pycon.cl/",
      "url": "https://pycon.cl/"
    },
    {
      "label": "https://t.me/pythonchile",
      "url": "https://t.me/pythonchile"
    },
    {
      "label": "https://discord.gg/dTHMfJvauS",
      "url": "https://discord.gg/dTHMfJvauS"
    }
  ],
  "speakers": [
    "Cristián Maureira Fredes"
  ],
  "tags": [
    "Keynote"
  ],
  "thumbnail_url": "https://i.ytimg.com/vi/kUKdJwER8FM/maxresdefault.jpg",
  "title": "El arte de extender Python con otros lenguajes",
  "videos": [
    {
      "type": "youtube",
      "url": "https://www.youtube.com/watch?v=kUKdJwER8FM"
    }
  ]
}
