{
  "description": "*Charla (en español): Panel Mujeres en Tecnología: Trayectorias Profesionales y Perspectivas Inspiradoras*\n\nPanel PyCon Chile 2023, Track Datos, Domingo 26 Noviembre 2023.\n\nMaría Elena Berlinger, Katherine Vergara, María Isabel Florez y Denny Perez tienen una conversación fascinante donde comparten las experiencias y logros de mujeres destacadas en la industria tecnológica. En este panel podrás conocer sus inspiradoras trayectorias profesionales, los desafíos que han superado y las valiosas perspectivas que aportan al mundo de la tecnología, además de entregar una visión única del impacto y la diversidad de las voces femeninas en el ámbito tecnológico.\n\n----\n\nPyCon Chile 2023 - https://pycon.cl/\n\nPyCon Chile es un evento gratuito organizado por la comunidad Python Chile, para promover la divulgación y enseñanza de Python. Esta conferencia busca reunir a todos los entusiastas de Python, desde principiantes hasta usuarios avanzados, para compartir distintas temáticas relacionadas al lenguaje.\n\nSi te interesa utilizar Python en áreas tan variadas como ciencia de datos, inteligencia artificial, astronomía, geología, optimización matemática o ciencias sociales, entre otras, ¡este evento te encantará!\n\n----\n\n★ ¡Únete a la comunidad PythonChile! ★\n\n• Twitter: https://twitter.com/pythonchiledev\n• Facebook: https://www.facebook.com/groups/pytho...\n• Telegram: https://t.me/pythonchile\n• Discord: https://discord.gg/dTHMfJvauS",
  "duration": 2336,
  "language": "spa",
  "recorded": "2022-11-24",
  "related_urls": [
    {
      "label": "Conference Website",
      "url": "https://pycon.cl/2023/"
    },
    {
      "label": "https://twitter.com/pythonchiledev",
      "url": "https://twitter.com/pythonchiledev"
    },
    {
      "label": "https://www.facebook.com/groups/pytho...",
      "url": "https://www.facebook.com/groups/pytho..."
    },
    {
      "label": "https://pycon.cl/",
      "url": "https://pycon.cl/"
    },
    {
      "label": "https://t.me/pythonchile",
      "url": "https://t.me/pythonchile"
    },
    {
      "label": "https://discord.gg/dTHMfJvauS",
      "url": "https://discord.gg/dTHMfJvauS"
    }
  ],
  "speakers": [
    "María Elena Berlinger",
    "Katherine Vergara",
    "María Isabel Florez",
    "Denny Perez"
  ],
  "tags": [],
  "thumbnail_url": "https://i.ytimg.com/vi/032JYRX00WU/maxresdefault.jpg",
  "title": "Panel Mujeres en Tecnología: Trayectorias Profesionales y Perspectivas Inspiradoras",
  "videos": [
    {
      "type": "youtube",
      "url": "https://www.youtube.com/watch?v=032JYRX00WU"
    }
  ]
}
